16:38:59.584356 IP lamp-s-1vcpu-1gb-tor1-01.ssh > 198.96.85.21.57248: Flags [P.], seq 596776:596948, ack 325, win 313, length 172
16:38:59.584449 IP lamp-s-1vcpu-1gb-tor1-01.ssh > 198.96.85.21.57248: Flags [P.], seq 596948:597120, ack 325, win 313, length 172
16:38:59.584542 IP lamp-s-1vcpu-1gb-tor1-01.ssh > 198.96.85.21.57248: Flags [P.], seq 597120:597292, ack 325, win 313, length 172
16:38:59.584632 IP lamp-s-1vcpu-1gb-tor1-01.ssh > 198.96.85.21.57248: Flags [P.], seq 597292:597464, ack 325, win 313, length 172
16:38:59.584766 IP lamp-s-1vcpu-1gb-tor1-01.ssh > 198.96.85.21.57248: Flags [P.], seq 597464:597636, ack 325, win 313, length 172
16:38:59.584858 IP lamp-s-1vcpu-1gb-tor1-01.ssh > 198.96.85.21.57248: Flags [P.], seq 597636:597808, ack 325, win 313, length 172
16:38:59.584953 IP lamp-s-1vcpu-1gb-tor1-01.ssh > 198.96.85.21.57248: Flags [P.], seq 597808:597980, ack 325, win 313, length 172
16:38:59.585045 IP lamp-s-1vcpu-1gb-tor1-01.ssh > 198.96.85.21.57248: Flags [P.], seq 597980:598152, ack 325, win 313, length 172
16:38:59.585141 IP lamp-s-1vcpu-1gb-tor1-01.ssh > 198.96.85.21.57248: Flags [P.], seq 598152:598324, ack 325, win 313, length 172
16:38:59.585232 IP 198.96.85.21.57248 > lamp-s-1vcpu-1gb-tor1-01.ssh: Flags [.], ack 588932, win 4103, length 0
16:38:59.585253 IP 198.96.85.21.57248 > lamp-s-1vcpu-1gb-tor1-01.ssh: Flags [.], ack 591340, win 4103, length 0
16:38:59.585272 IP 198.96.85.21.57248 > lamp-s-1vcpu-1gb-tor1-01.ssh: Flags [.], ack 591736, win 4101, options [nop,nop,sack 1 {591908:593456}], length 0
16:38:59.585441 IP lamp-s-1vcpu-1gb-tor1-01.ssh > 198.96.85.21.57248: Flags [P.], seq 598324:598496, ack 325, win 313, length 172
16:38:59.585537 IP lamp-s-1vcpu-1gb-tor1-01.ssh > 198.96.85.21.57248: Flags [P.], seq 598496:598916, ack 325, win 313, length 420
16:38:59.585623 IP lamp-s-1vcpu-1gb-tor1-01.ssh > 198.96.85.21.57248: Flags [P.], seq 598916:599088, ack 325, win 313, length 172
16:38:59.585711 IP lamp-s-1vcpu-1gb-tor1-01.ssh > 198.96.85.21.57248: Flags [P.], seq 599088:599260, ack 325, win 313, length 172
16:38:59.585819 IP lamp-s-1vcpu-1gb-tor1-01.ssh > 198.96.85.21.57248: Flags [P.], seq 599260:599432, ack 325, win 313, length 172
16:38:59.585899 IP lamp-s-1vcpu-1gb-tor1-01.ssh > 198.96.85.21.57248: Flags [P.], seq 599432:599604, ack 325, win 313, length 172
16:38:59.586002 IP lamp-s-1vcpu-1gb-tor1-01.ssh > 198.96.85.21.57248: Flags [P.], seq 599604:599776, ack 325, win 313, length 172
16:38:59.586094 IP lamp-s-1vcpu-1gb-tor1-01.ssh > 198.96.85.21.57248: Flags [P.], seq 599776:599948, ack 325, win 313, length 172
16:38:59.586177 IP lamp-s-1vcpu-1gb-tor1-01.ssh > 198.96.85.21.57248: Flags [P.], seq 599948:600120, ack 325, win 313, length 172
16:38:59.586246 IP lamp-s-1vcpu-1gb-tor1-01.ssh > 198.96.85.21.57248: Flags [P.], seq 600120:600292, ack 325, win 313, length 172
16:38:59.586848 IP 198.96.85.21.57248 > lamp-s-1vcpu-1gb-tor1-01.ssh: Flags [.], ack 591736, win 4101, options [nop,nop,sack 1 {591908:595520}], length 0
16:38:59.586892 IP lamp-s-1vcpu-1gb-tor1-01.ssh > 198.96.85.21.57248: Flags [P.], seq 591736:591908, ack 325, win 313, length 172
16:38:59.586912 IP lamp-s-1vcpu-1gb-tor1-01.ssh > 198.96.85.21.57248: Flags [P.], seq 600292:600636, ack 325, win 313, length 344
16:38:59.586917 IP 198.96.85.21.57248 > lamp-s-1vcpu-1gb-tor1-01.ssh: Flags [.], ack 591736, win 4101, options [nop,nop,sack 1 {591908:595692}], length 0
16:38:59.586940 IP 198.96.85.21.57248 > lamp-s-1vcpu-1gb-tor1-01.ssh: Flags [.], ack 591736, win 4101, options [nop,nop,sack 1 {591908:596088}], length 0
16:38:59.586947 IP 198.96.85.21.57248 > lamp-s-1vcpu-1gb-tor1-01.ssh: Flags [.], ack 591736, win 4101, options [nop,nop,sack 1 {591908:596604}], length 0
16:38:59.587152 IP lamp-s-1vcpu-1gb-tor1-01.ssh > 198.96.85.21.57248: Flags [P.], seq 600636:601552, ack 325, win 313, length 916
16:38:59.587251 IP lamp-s-1vcpu-1gb-tor1-01.ssh > 198.96.85.21.57248: Flags [P.], seq 601552:601724, ack 325, win 313, length 172
16:38:59.587347 IP lamp-s-1vcpu-1gb-tor1-01.ssh > 198.96.85.21.57248: Flags [P.], seq 601724:601896, ack 325, win 313, length 172
16:38:59.588492 IP 198.96.85.21.57248 > lamp-s-1vcpu-1gb-tor1-01.ssh: Flags [.], ack 591736, win 4101, options [nop,nop,sack 1 {591908:598152}], length 0
16:38:59.588530 IP lamp-s-1vcpu-1gb-tor1-01.ssh > 198.96.85.21.57248: Flags [P.], seq 601896:602068, ack 325, win 313, length 172
16:38:59.588545 IP 198.96.85.21.57248 > lamp-s-1vcpu-1gb-tor1-01.ssh: Flags [.], ack 591736, win 4101, options [nop,nop,sack 1 {591908:598496}], length 0
16:38:59.588555 IP 198.96.85.21.57248 > lamp-s-1vcpu-1gb-tor1-01.ssh: Flags [.], ack 591736, win 4101, options [nop,nop,sack 1 {591908:598916}], length 0
16:38:59.588561 IP 198.96.85.21.57248 > lamp-s-1vcpu-1gb-tor1-01.ssh: Flags [.], ack 591736, win 4101, options [nop,nop,sack 1 {591908:599088}], length 0
16:38:59.588798 IP lamp-s-1vcpu-1gb-tor1-01.ssh > 198.96.85.21.57248: Flags [P.], seq 602068:602856, ack 325, win 313, length 788
16:38:59.603324 IP 198.96.85.21.57248 > lamp-s-1vcpu-1gb-tor1-01.ssh: Flags [.], ack 591736, win 4101, options [nop,nop,sack 1 {591908:600292}], length 0
16:38:59.603435 IP lamp-s-1vcpu-1gb-tor1-01.ssh > 198.96.85.21.57248: Flags [P.], seq 602856:603028, ack 325, win 313, length 172
16:38:59.603469 IP 198.96.85.21.57248 > lamp-s-1vcpu-1gb-tor1-01.ssh: Flags [.], ack 600292, win 4103, length 0
16:38:59.603496 IP 198.96.85.21.57248 > lamp-s-1vcpu-1gb-tor1-01.ssh: Flags [.], ack 602856, win 4103, length 0
16:38:59.603857 IP lamp-s-1vcpu-1gb-tor1-01.ssh > 198.96.85.21.57248: Flags [P.], seq 603028:603576, ack 325, win 313, length 548
16:38:59.604034 IP lamp-s-1vcpu-1gb-tor1-01.ssh > 198.96.85.21.57248: Flags [P.], seq 603576:603748, ack 325, win 313, length 172
16:38:59.604228 IP lamp-s-1vcpu-1gb-tor1-01.ssh > 198.96.85.21.57248: Flags [P.], seq 603748:603920, ack 325, win 313, length 172
16:38:59.604350 IP lamp-s-1vcpu-1gb-tor1-01.ssh > 198.96.85.21.57248: Flags [P.], seq 603920:604092, ack 325, win 313, length 172
16:38:59.604458 IP lamp-s-1vcpu-1gb-tor1-01.ssh > 198.96.85.21.57248: Flags [P.], seq 604092:604264, ack 325, win 313, length 172
16:38:59.604580 IP lamp-s-1vcpu-1gb-tor1-01.ssh > 198.96.85.21.57248: Flags [P.], seq 604264:604436, ack 325, win 313, length 172
16:38:59.604762 IP lamp-s-1vcpu-1gb-tor1-01.ssh > 198.96.85.21.57248: Flags [P.], seq 604436:604608, ack 325, win 313, length 172
16:38:59.604905 IP lamp-s-1vcpu-1gb-tor1-01.ssh > 198.96.85.21.57248: Flags [P.], seq 604608:604780, ack 325, win 313, length 172
16:38:59.605016 IP lamp-s-1vcpu-1gb-tor1-01.ssh > 198.96.85.21.57248: Flags [P.], seq 604780:604952, ack 325, win 313, length 172
16:38:59.605120 IP lamp-s-1vcpu-1gb-tor1-01.ssh > 198.96.85.21.57248: Flags [P.], seq 604952:605124, ack 325, win 313, length 172
16:38:59.605254 IP lamp-s-1vcpu-1gb-tor1-01.ssh > 198.96.85.21.57248: Flags [P.], seq 605124:605296, ack 325, win 313, length 172
16:38:59.605388 IP lamp-s-1vcpu-1gb-tor1-01.ssh > 198.96.85.21.57248: Flags [P.], seq 605296:605468, ack 325, win 313, length 172
16:38:59.605505 IP lamp-s-1vcpu-1gb-tor1-01.ssh > 198.96.85.21.57248: Flags [P.], seq 605468:605640, ack 325, win 313, length 172
16:38:59.605612 IP lamp-s-1vcpu-1gb-tor1-01.ssh > 198.96.85.21.57248: Flags [P.], seq 605640:605812, ack 325, win 313, length 172
16:38:59.605716 IP lamp-s-1vcpu-1gb-tor1-01.ssh > 198.96.85.21.57248: Flags [P.], seq 605812:605984, ack 325, win 313, length 172
16:38:59.605820 IP lamp-s-1vcpu-1gb-tor1-01.ssh > 198.96.85.21.57248: Flags [P.], seq 605984:606156, ack 325, win 313, length 172
16:38:59.605951 IP lamp-s-1vcpu-1gb-tor1-01.ssh > 198.96.85.21.57248: Flags [P.], seq 606156:606328, ack 325, win 313, length 172
16:38:59.606110 IP 198.96.85.21.57248 > lamp-s-1vcpu-1gb-tor1-01.ssh: Flags [P.], seq 325:361, ack 602856, win 4103, length 36
16:38:59.606192 IP lamp-s-1vcpu-1gb-tor1-01.ssh > 198.96.85.21.57248: Flags [P.], seq 606328:606500, ack 325, win 313, length 172
^C
3680 packets captured
3702 packets received by filter
22 packets dropped by kernel
root@lamp-s-1vcpu-1gb-tor1-01:~#
