16:38:39.510833 IP 198.96.85.21.57248 > lamp-s-1vcpu-1gb-tor1-01.ssh: Flags [.], ack 694280, win 4103, length 0
16:38:39.510863 IP 198.96.85.21.57248 > lamp-s-1vcpu-1gb-tor1-01.ssh: Flags [.], ack 694452, win 4102, length 0
16:38:39.510956 IP lamp-s-1vcpu-1gb-tor1-01.ssh > 198.96.85.21.57248: Flags [P.], seq 698056:698228, ack 397, win 313, length 172
16:38:39.511043 IP lamp-s-1vcpu-1gb-tor1-01.ssh > 198.96.85.21.57248: Flags [P.], seq 698228:698488, ack 397, win 313, length 260
16:38:39.511125 IP lamp-s-1vcpu-1gb-tor1-01.ssh > 198.96.85.21.57248: Flags [P.], seq 698488:698660, ack 397, win 313, length 172
16:38:39.511211 IP lamp-s-1vcpu-1gb-tor1-01.ssh > 198.96.85.21.57248: Flags [P.], seq 698660:698832, ack 397, win 313, length 172
16:38:39.511290 IP lamp-s-1vcpu-1gb-tor1-01.ssh > 198.96.85.21.57248: Flags [P.], seq 698832:699004, ack 397, win 313, length 172
16:38:39.511370 IP lamp-s-1vcpu-1gb-tor1-01.ssh > 198.96.85.21.57248: Flags [P.], seq 699004:699176, ack 397, win 313, length 172
16:38:39.511449 IP lamp-s-1vcpu-1gb-tor1-01.ssh > 198.96.85.21.57248: Flags [P.], seq 699176:699348, ack 397, win 313, length 172
16:38:39.511531 IP lamp-s-1vcpu-1gb-tor1-01.ssh > 198.96.85.21.57248: Flags [P.], seq 699348:699520, ack 397, win 313, length 172
16:38:39.511611 IP lamp-s-1vcpu-1gb-tor1-01.ssh > 198.96.85.21.57248: Flags [P.], seq 699520:699692, ack 397, win 313, length 172
16:38:39.511693 IP lamp-s-1vcpu-1gb-tor1-01.ssh > 198.96.85.21.57248: Flags [P.], seq 699692:699864, ack 397, win 313, length 172
16:38:39.511781 IP lamp-s-1vcpu-1gb-tor1-01.ssh > 198.96.85.21.57248: Flags [P.], seq 699864:700036, ack 397, win 313, length 172
16:38:39.511865 IP lamp-s-1vcpu-1gb-tor1-01.ssh > 198.96.85.21.57248: Flags [P.], seq 700036:700208, ack 397, win 313, length 172
16:38:39.511946 IP lamp-s-1vcpu-1gb-tor1-01.ssh > 198.96.85.21.57248: Flags [P.], seq 700208:700380, ack 397, win 313, length 172
16:38:39.512028 IP lamp-s-1vcpu-1gb-tor1-01.ssh > 198.96.85.21.57248: Flags [P.], seq 700380:700552, ack 397, win 313, length 172
16:38:39.512110 IP lamp-s-1vcpu-1gb-tor1-01.ssh > 198.96.85.21.57248: Flags [P.], seq 700552:700724, ack 397, win 313, length 172
16:38:39.512188 IP lamp-s-1vcpu-1gb-tor1-01.ssh > 198.96.85.21.57248: Flags [P.], seq 700724:700896, ack 397, win 313, length 172
16:38:39.512267 IP lamp-s-1vcpu-1gb-tor1-01.ssh > 198.96.85.21.57248: Flags [P.], seq 700896:701068, ack 397, win 313, length 172
16:38:39.512347 IP lamp-s-1vcpu-1gb-tor1-01.ssh > 198.96.85.21.57248: Flags [P.], seq 701068:701240, ack 397, win 313, length 172
16:38:39.512428 IP lamp-s-1vcpu-1gb-tor1-01.ssh > 198.96.85.21.57248: Flags [P.], seq 701240:701412, ack 397, win 313, length 172
16:38:39.512509 IP lamp-s-1vcpu-1gb-tor1-01.ssh > 198.96.85.21.57248: Flags [P.], seq 701412:701584, ack 397, win 313, length 172
16:38:39.512591 IP lamp-s-1vcpu-1gb-tor1-01.ssh > 198.96.85.21.57248: Flags [P.], seq 701584:701756, ack 397, win 313, length 172
16:38:39.512699 IP lamp-s-1vcpu-1gb-tor1-01.ssh > 198.96.85.21.57248: Flags [P.], seq 701756:701928, ack 397, win 313, length 172
16:38:39.512784 IP lamp-s-1vcpu-1gb-tor1-01.ssh > 198.96.85.21.57248: Flags [P.], seq 701928:702100, ack 397, win 313, length 172
16:38:39.512867 IP lamp-s-1vcpu-1gb-tor1-01.ssh > 198.96.85.21.57248: Flags [P.], seq 702100:702272, ack 397, win 313, length 172
16:38:39.512948 IP lamp-s-1vcpu-1gb-tor1-01.ssh > 198.96.85.21.57248: Flags [P.], seq 702272:702444, ack 397, win 313, length 172
16:38:39.513029 IP lamp-s-1vcpu-1gb-tor1-01.ssh > 198.96.85.21.57248: Flags [P.], seq 702444:702616, ack 397, win 313, length 172
16:38:39.513127 IP lamp-s-1vcpu-1gb-tor1-01.ssh > 198.96.85.21.57248: Flags [P.], seq 702616:702788, ack 397, win 313, length 172
16:38:39.513208 IP lamp-s-1vcpu-1gb-tor1-01.ssh > 198.96.85.21.57248: Flags [P.], seq 702788:702960, ack 397, win 313, length 172
16:38:39.513287 IP lamp-s-1vcpu-1gb-tor1-01.ssh > 198.96.85.21.57248: Flags [P.], seq 702960:703132, ack 397, win 313, length 172
16:38:39.513377 IP lamp-s-1vcpu-1gb-tor1-01.ssh > 198.96.85.21.57248: Flags [P.], seq 703132:703304, ack 397, win 313, length 172
16:38:39.513459 IP lamp-s-1vcpu-1gb-tor1-01.ssh > 198.96.85.21.57248: Flags [P.], seq 703304:703476, ack 397, win 313, length 172
16:38:39.513541 IP lamp-s-1vcpu-1gb-tor1-01.ssh > 198.96.85.21.57248: Flags [P.], seq 703476:703648, ack 397, win 313, length 172
16:38:39.513625 IP lamp-s-1vcpu-1gb-tor1-01.ssh > 198.96.85.21.57248: Flags [P.], seq 703648:703820, ack 397, win 313, length 172
16:38:39.513707 IP lamp-s-1vcpu-1gb-tor1-01.ssh > 198.96.85.21.57248: Flags [P.], seq 703820:703992, ack 397, win 313, length 172
16:38:39.513788 IP lamp-s-1vcpu-1gb-tor1-01.ssh > 198.96.85.21.57248: Flags [P.], seq 703992:704164, ack 397, win 313, length 172
16:38:39.513870 IP lamp-s-1vcpu-1gb-tor1-01.ssh > 198.96.85.21.57248: Flags [P.], seq 704164:704336, ack 397, win 313, length 172
16:38:39.513951 IP lamp-s-1vcpu-1gb-tor1-01.ssh > 198.96.85.21.57248: Flags [P.], seq 704336:704508, ack 397, win 313, length 172
16:38:39.514060 IP lamp-s-1vcpu-1gb-tor1-01.ssh > 198.96.85.21.57248: Flags [P.], seq 704508:704680, ack 397, win 313, length 172
16:38:39.514148 IP lamp-s-1vcpu-1gb-tor1-01.ssh > 198.96.85.21.57248: Flags [P.], seq 704680:704852, ack 397, win 313, length 172
16:38:39.514228 IP lamp-s-1vcpu-1gb-tor1-01.ssh > 198.96.85.21.57248: Flags [P.], seq 704852:705024, ack 397, win 313, length 172
16:38:39.514308 IP lamp-s-1vcpu-1gb-tor1-01.ssh > 198.96.85.21.57248: Flags [P.], seq 705024:705196, ack 397, win 313, length 172
16:38:39.514389 IP lamp-s-1vcpu-1gb-tor1-01.ssh > 198.96.85.21.57248: Flags [P.], seq 705196:705368, ack 397, win 313, length 172
16:38:39.514477 IP lamp-s-1vcpu-1gb-tor1-01.ssh > 198.96.85.21.57248: Flags [P.], seq 705368:705540, ack 397, win 313, length 172
16:38:39.514562 IP lamp-s-1vcpu-1gb-tor1-01.ssh > 198.96.85.21.57248: Flags [P.], seq 705540:705712, ack 397, win 313, length 172
16:38:39.514645 IP lamp-s-1vcpu-1gb-tor1-01.ssh > 198.96.85.21.57248: Flags [P.], seq 705712:705884, ack 397, win 313, length 172
16:38:39.514727 IP lamp-s-1vcpu-1gb-tor1-01.ssh > 198.96.85.21.57248: Flags [P.], seq 705884:706056, ack 397, win 313, length 172
16:38:39.514808 IP lamp-s-1vcpu-1gb-tor1-01.ssh > 198.96.85.21.57248: Flags [P.], seq 706056:706228, ack 397, win 313, length 172
16:38:39.514890 IP lamp-s-1vcpu-1gb-tor1-01.ssh > 198.96.85.21.57248: Flags [P.], seq 706228:706400, ack 397, win 313, length 172
16:38:39.514970 IP lamp-s-1vcpu-1gb-tor1-01.ssh > 198.96.85.21.57248: Flags [P.], seq 706400:706572, ack 397, win 313, length 172
16:38:39.515052 IP lamp-s-1vcpu-1gb-tor1-01.ssh > 198.96.85.21.57248: Flags [P.], seq 706572:706744, ack 397, win 313, length 172
16:38:39.515138 IP lamp-s-1vcpu-1gb-tor1-01.ssh > 198.96.85.21.57248: Flags [P.], seq 706744:706916, ack 397, win 313, length 172
16:38:39.515220 IP lamp-s-1vcpu-1gb-tor1-01.ssh > 198.96.85.21.57248: Flags [P.], seq 706916:707088, ack 397, win 313, length 172
16:38:39.584798 IP lamp-s-1vcpu-1gb-tor1-01.ssh > 198.96.85.21.57248: Flags [P.], seq 707088:707432, ack 397, win 313, length 344
16:38:39.647868 IP 198.96.85.21.57248 > lamp-s-1vcpu-1gb-tor1-01.ssh: Flags [.], ack 697540, win 4103, length 0
16:38:39.647970 IP lamp-s-1vcpu-1gb-tor1-01.ssh > 198.96.85.21.57248: Flags [P.], seq 707432:707604, ack 397, win 313, length 172
16:38:39.648001 IP 198.96.85.21.57248 > lamp-s-1vcpu-1gb-tor1-01.ssh: Flags [.], ack 700380, win 4103, length 0
16:38:39.648043 IP 198.96.85.21.57248 > lamp-s-1vcpu-1gb-tor1-01.ssh: Flags [.], ack 703132, win 4103, length 0
16:38:39.648066 IP 198.96.85.21.57248 > lamp-s-1vcpu-1gb-tor1-01.ssh: Flags [.], ack 705540, win 4103, length 0
16:38:39.648109 IP 198.96.85.21.57248 > lamp-s-1vcpu-1gb-tor1-01.ssh: Flags [.], ack 707088, win 4103, length 0
16:38:39.648121 IP 198.96.85.21.57248 > lamp-s-1vcpu-1gb-tor1-01.ssh: Flags [P.], seq 397:433, ack 707088, win 4103, length 36
^C
4289 packets captured
4344 packets received by filter
55 packets dropped by kernel
root@lamp-s-1vcpu-1gb-tor1-01:~#
