16:31:07.558837 IP lamp-s-1vcpu-1gb-tor1-01.ssh > 198.96.85.21.57248: Flags [P.], seq 61764:61928, ack 37, win 313, length 164
16:31:07.558946 IP lamp-s-1vcpu-1gb-tor1-01.ssh > 198.96.85.21.57248: Flags [P.], seq 61928:62092, ack 37, win 313, length 164
16:31:07.559071 IP lamp-s-1vcpu-1gb-tor1-01.ssh > 198.96.85.21.57248: Flags [P.], seq 62092:62256, ack 37, win 313, length 164
16:31:07.559176 IP lamp-s-1vcpu-1gb-tor1-01.ssh > 198.96.85.21.57248: Flags [P.], seq 62256:62420, ack 37, win 313, length 164
16:31:07.559280 IP lamp-s-1vcpu-1gb-tor1-01.ssh > 198.96.85.21.57248: Flags [P.], seq 62420:62584, ack 37, win 313, length 164
16:31:07.559403 IP lamp-s-1vcpu-1gb-tor1-01.ssh > 198.96.85.21.57248: Flags [P.], seq 62584:62748, ack 37, win 313, length 164
16:31:07.559506 IP lamp-s-1vcpu-1gb-tor1-01.ssh > 198.96.85.21.57248: Flags [P.], seq 62748:62912, ack 37, win 313, length 164
16:31:07.559618 IP lamp-s-1vcpu-1gb-tor1-01.ssh > 198.96.85.21.57248: Flags [P.], seq 62912:63076, ack 37, win 313, length 164
16:31:07.559728 IP lamp-s-1vcpu-1gb-tor1-01.ssh > 198.96.85.21.57248: Flags [P.], seq 63076:63240, ack 37, win 313, length 164
16:31:07.559831 IP lamp-s-1vcpu-1gb-tor1-01.ssh > 198.96.85.21.57248: Flags [P.], seq 63240:63404, ack 37, win 313, length 164
16:31:07.559937 IP lamp-s-1vcpu-1gb-tor1-01.ssh > 198.96.85.21.57248: Flags [P.], seq 63404:63568, ack 37, win 313, length 164
16:31:07.560058 IP lamp-s-1vcpu-1gb-tor1-01.ssh > 198.96.85.21.57248: Flags [P.], seq 63568:63732, ack 37, win 313, length 164
16:31:07.560158 IP lamp-s-1vcpu-1gb-tor1-01.ssh > 198.96.85.21.57248: Flags [P.], seq 63732:63896, ack 37, win 313, length 164
16:31:07.560265 IP lamp-s-1vcpu-1gb-tor1-01.ssh > 198.96.85.21.57248: Flags [P.], seq 63896:64060, ack 37, win 313, length 164
16:31:07.560368 IP lamp-s-1vcpu-1gb-tor1-01.ssh > 198.96.85.21.57248: Flags [P.], seq 64060:64224, ack 37, win 313, length 164
16:31:07.560476 IP lamp-s-1vcpu-1gb-tor1-01.ssh > 198.96.85.21.57248: Flags [P.], seq 64224:64388, ack 37, win 313, length 164
16:31:07.560590 IP lamp-s-1vcpu-1gb-tor1-01.ssh > 198.96.85.21.57248: Flags [P.], seq 64388:64552, ack 37, win 313, length 164
16:31:07.604081 IP 198.96.85.21.57248 > lamp-s-1vcpu-1gb-tor1-01.ssh: Flags [.], ack 57380, win 512, length 0
16:31:07.604174 IP lamp-s-1vcpu-1gb-tor1-01.ssh > 198.96.85.21.57248: Flags [P.], seq 64552:64716, ack 37, win 313, length 164
16:31:07.604204 IP 198.96.85.21.57248 > lamp-s-1vcpu-1gb-tor1-01.ssh: Flags [.], ack 58200, win 509, length 0
16:31:07.604219 IP 198.96.85.21.57248 > lamp-s-1vcpu-1gb-tor1-01.ssh: Flags [.], ack 58528, win 508, length 0
16:31:07.604226 IP 198.96.85.21.57248 > lamp-s-1vcpu-1gb-tor1-01.ssh: Flags [.], ack 58856, win 512, length 0
16:31:07.604233 IP 198.96.85.21.57248 > lamp-s-1vcpu-1gb-tor1-01.ssh: Flags [.], ack 59184, win 511, length 0
16:31:07.604239 IP 198.96.85.21.57248 > lamp-s-1vcpu-1gb-tor1-01.ssh: Flags [.], ack 59624, win 509, length 0
16:31:07.604606 IP lamp-s-1vcpu-1gb-tor1-01.ssh > 198.96.85.21.57248: Flags [P.], seq 64716:65544, ack 37, win 313, length 828
16:31:07.604761 IP lamp-s-1vcpu-1gb-tor1-01.ssh > 198.96.85.21.57248: Flags [P.], seq 65544:65708, ack 37, win 313, length 164
16:31:07.604860 IP lamp-s-1vcpu-1gb-tor1-01.ssh > 198.96.85.21.57248: Flags [P.], seq 65708:65872, ack 37, win 313, length 164
16:31:07.604953 IP lamp-s-1vcpu-1gb-tor1-01.ssh > 198.96.85.21.57248: Flags [P.], seq 65872:66036, ack 37, win 313, length 164
16:31:07.605042 IP lamp-s-1vcpu-1gb-tor1-01.ssh > 198.96.85.21.57248: Flags [P.], seq 66036:66200, ack 37, win 313, length 164
16:31:07.605132 IP lamp-s-1vcpu-1gb-tor1-01.ssh > 198.96.85.21.57248: Flags [P.], seq 66200:66364, ack 37, win 313, length 164
16:31:07.605222 IP lamp-s-1vcpu-1gb-tor1-01.ssh > 198.96.85.21.57248: Flags [P.], seq 66364:66528, ack 37, win 313, length 164
16:31:07.605320 IP lamp-s-1vcpu-1gb-tor1-01.ssh > 198.96.85.21.57248: Flags [P.], seq 66528:66692, ack 37, win 313, length 164
16:31:07.605413 IP lamp-s-1vcpu-1gb-tor1-01.ssh > 198.96.85.21.57248: Flags [P.], seq 66692:66856, ack 37, win 313, length 164
16:31:07.605505 IP lamp-s-1vcpu-1gb-tor1-01.ssh > 198.96.85.21.57248: Flags [P.], seq 66856:67020, ack 37, win 313, length 164
16:31:07.605597 IP lamp-s-1vcpu-1gb-tor1-01.ssh > 198.96.85.21.57248: Flags [P.], seq 67020:67184, ack 37, win 313, length 164
16:31:07.605689 IP lamp-s-1vcpu-1gb-tor1-01.ssh > 198.96.85.21.57248: Flags [P.], seq 67184:67348, ack 37, win 313, length 164
16:31:07.605781 IP lamp-s-1vcpu-1gb-tor1-01.ssh > 198.96.85.21.57248: Flags [P.], seq 67348:67512, ack 37, win 313, length 164
16:31:07.605876 IP lamp-s-1vcpu-1gb-tor1-01.ssh > 198.96.85.21.57248: Flags [P.], seq 67512:67676, ack 37, win 313, length 164
16:31:07.605969 IP lamp-s-1vcpu-1gb-tor1-01.ssh > 198.96.85.21.57248: Flags [P.], seq 67676:67840, ack 37, win 313, length 164
16:31:07.606088 IP lamp-s-1vcpu-1gb-tor1-01.ssh > 198.96.85.21.57248: Flags [P.], seq 67840:68004, ack 37, win 313, length 164
16:31:07.606233 IP lamp-s-1vcpu-1gb-tor1-01.ssh > 198.96.85.21.57248: Flags [P.], seq 68004:68168, ack 37, win 313, length 164
16:31:07.606339 IP lamp-s-1vcpu-1gb-tor1-01.ssh > 198.96.85.21.57248: Flags [P.], seq 68168:68332, ack 37, win 313, length 164
16:31:07.606432 IP lamp-s-1vcpu-1gb-tor1-01.ssh > 198.96.85.21.57248: Flags [P.], seq 68332:68496, ack 37, win 313, length 164
16:31:07.606525 IP lamp-s-1vcpu-1gb-tor1-01.ssh > 198.96.85.21.57248: Flags [P.], seq 68496:68660, ack 37, win 313, length 164
16:31:07.606617 IP lamp-s-1vcpu-1gb-tor1-01.ssh > 198.96.85.21.57248: Flags [P.], seq 68660:68824, ack 37, win 313, length 164
16:31:07.606709 IP lamp-s-1vcpu-1gb-tor1-01.ssh > 198.96.85.21.57248: Flags [P.], seq 68824:68988, ack 37, win 313, length 164
16:31:07.606802 IP lamp-s-1vcpu-1gb-tor1-01.ssh > 198.96.85.21.57248: Flags [P.], seq 68988:69152, ack 37, win 313, length 164
16:31:07.606895 IP lamp-s-1vcpu-1gb-tor1-01.ssh > 198.96.85.21.57248: Flags [P.], seq 69152:69316, ack 37, win 313, length 164
16:31:07.606988 IP lamp-s-1vcpu-1gb-tor1-01.ssh > 198.96.85.21.57248: Flags [P.], seq 69316:69480, ack 37, win 313, length 164
16:31:07.607079 IP lamp-s-1vcpu-1gb-tor1-01.ssh > 198.96.85.21.57248: Flags [P.], seq 69480:69644, ack 37, win 313, length 164
16:31:07.607168 IP lamp-s-1vcpu-1gb-tor1-01.ssh > 198.96.85.21.57248: Flags [P.], seq 69644:69808, ack 37, win 313, length 164
16:31:07.607215 IP 198.96.85.21.57248 > lamp-s-1vcpu-1gb-tor1-01.ssh: Flags [.], ack 60936, win 510, length 0
16:31:07.607234 IP 198.96.85.21.57248 > lamp-s-1vcpu-1gb-tor1-01.ssh: Flags [.], ack 61264, win 509, length 0
16:31:07.607352 IP lamp-s-1vcpu-1gb-tor1-01.ssh > 198.96.85.21.57248: Flags [P.], seq 69808:70196, ack 37, win 313, length 388
16:31:07.607450 IP lamp-s-1vcpu-1gb-tor1-01.ssh > 198.96.85.21.57248: Flags [P.], seq 70196:70360, ack 37, win 313, length 164
16:31:07.607543 IP lamp-s-1vcpu-1gb-tor1-01.ssh > 198.96.85.21.57248: Flags [P.], seq 70360:70524, ack 37, win 313, length 164
16:31:07.607635 IP lamp-s-1vcpu-1gb-tor1-01.ssh > 198.96.85.21.57248: Flags [P.], seq 70524:70688, ack 37, win 313, length 164
16:31:07.607727 IP lamp-s-1vcpu-1gb-tor1-01.ssh > 198.96.85.21.57248: Flags [P.], seq 70688:70852, ack 37, win 313, length 164
16:31:07.607821 IP lamp-s-1vcpu-1gb-tor1-01.ssh > 198.96.85.21.57248: Flags [P.], seq 70852:71016, ack 37, win 313, length 164
16:31:07.607921 IP lamp-s-1vcpu-1gb-tor1-01.ssh > 198.96.85.21.57248: Flags [P.], seq 71016:71180, ack 37, win 313, length 164
16:31:07.608032 IP lamp-s-1vcpu-1gb-tor1-01.ssh > 198.96.85.21.57248: Flags [P.], seq 71180:71344, ack 37, win 313, length 164
16:31:07.608122 IP lamp-s-1vcpu-1gb-tor1-01.ssh > 198.96.85.21.57248: Flags [P.], seq 71344:71508, ack 37, win 313, length 164
16:31:07.608211 IP lamp-s-1vcpu-1gb-tor1-01.ssh > 198.96.85.21.57248: Flags [P.], seq 71508:71672, ack 37, win 313, length 164
16:31:07.608303 IP lamp-s-1vcpu-1gb-tor1-01.ssh > 198.96.85.21.57248: Flags [P.], seq 71672:71836, ack 37, win 313, length 164
16:31:07.608393 IP lamp-s-1vcpu-1gb-tor1-01.ssh > 198.96.85.21.57248: Flags [P.], seq 71836:72000, ack 37, win 313, length 164
16:31:07.653961 IP 198.96.85.21.57248 > lamp-s-1vcpu-1gb-tor1-01.ssh: Flags [.], ack 62420, win 512, length 0
16:31:07.654067 IP lamp-s-1vcpu-1gb-tor1-01.ssh > 198.96.85.21.57248: Flags [P.], seq 72000:72164, ack 37, win 313, length 164
16:31:07.654098 IP 198.96.85.21.57248 > lamp-s-1vcpu-1gb-tor1-01.ssh: Flags [.], ack 62584, win 512, length 0
16:31:07.654109 IP 198.96.85.21.57248 > lamp-s-1vcpu-1gb-tor1-01.ssh: Flags [.], ack 63076, win 510, length 0
16:31:07.654121 IP 198.96.85.21.57248 > lamp-s-1vcpu-1gb-tor1-01.ssh: Flags [.], ack 63240, win 509, length 0
16:31:07.654426 IP lamp-s-1vcpu-1gb-tor1-01.ssh > 198.96.85.21.57248: Flags [P.], seq 72164:72776, ack 37, win 313, length 612
16:31:07.654530 IP lamp-s-1vcpu-1gb-tor1-01.ssh > 198.96.85.21.57248: Flags [P.], seq 72776:72940, ack 37, win 313, length 164
16:31:07.654629 IP lamp-s-1vcpu-1gb-tor1-01.ssh > 198.96.85.21.57248: Flags [P.], seq 72940:73104, ack 37, win 313, length 164
16:31:07.654723 IP lamp-s-1vcpu-1gb-tor1-01.ssh > 198.96.85.21.57248: Flags [P.], seq 73104:73268, ack 37, win 313, length 164
16:31:07.654826 IP lamp-s-1vcpu-1gb-tor1-01.ssh > 198.96.85.21.57248: Flags [P.], seq 73268:73432, ack 37, win 313, length 164
16:31:07.654921 IP lamp-s-1vcpu-1gb-tor1-01.ssh > 198.96.85.21.57248: Flags [P.], seq 73432:73596, ack 37, win 313, length 164
16:31:07.655018 IP lamp-s-1vcpu-1gb-tor1-01.ssh > 198.96.85.21.57248: Flags [P.], seq 73596:73760, ack 37, win 313, length 164
16:31:07.655112 IP lamp-s-1vcpu-1gb-tor1-01.ssh > 198.96.85.21.57248: Flags [P.], seq 73760:73924, ack 37, win 313, length 164
16:31:07.655221 IP lamp-s-1vcpu-1gb-tor1-01.ssh > 198.96.85.21.57248: Flags [P.], seq 73924:74088, ack 37, win 313, length 164
16:31:07.655317 IP lamp-s-1vcpu-1gb-tor1-01.ssh > 198.96.85.21.57248: Flags [P.], seq 74088:74252, ack 37, win 313, length 164
16:31:07.658122 IP 198.96.85.21.57248 > lamp-s-1vcpu-1gb-tor1-01.ssh: Flags [.], ack 63896, win 512, length 0
16:31:07.658159 IP lamp-s-1vcpu-1gb-tor1-01.ssh > 198.96.85.21.57248: Flags [P.], seq 74252:74416, ack 37, win 313, length 164
16:31:07.658180 IP 198.96.85.21.57248 > lamp-s-1vcpu-1gb-tor1-01.ssh: Flags [.], ack 64224, win 511, length 0
16:31:07.658343 IP lamp-s-1vcpu-1gb-tor1-01.ssh > 198.96.85.21.57248: Flags [P.], seq 74416:74804, ack 37, win 313, length 388
16:31:07.658464 IP lamp-s-1vcpu-1gb-tor1-01.ssh > 198.96.85.21.57248: Flags [P.], seq 74804:74968, ack 37, win 313, length 164
16:31:07.658562 IP lamp-s-1vcpu-1gb-tor1-01.ssh > 198.96.85.21.57248: Flags [P.], seq 74968:75132, ack 37, win 313, length 164
16:31:07.658657 IP lamp-s-1vcpu-1gb-tor1-01.ssh > 198.96.85.21.57248: Flags [P.], seq 75132:75296, ack 37, win 313, length 164
16:31:07.658750 IP lamp-s-1vcpu-1gb-tor1-01.ssh > 198.96.85.21.57248: Flags [P.], seq 75296:75460, ack 37, win 313, length 164
16:31:07.661249 IP 198.96.85.21.57248 > lamp-s-1vcpu-1gb-tor1-01.ssh: Flags [.], ack 64552, win 510, length 0
16:31:07.661290 IP lamp-s-1vcpu-1gb-tor1-01.ssh > 198.96.85.21.57248: Flags [P.], seq 75460:75624, ack 37, win 313, length 164
16:31:07.661304 IP 198.96.85.21.57248 > lamp-s-1vcpu-1gb-tor1-01.ssh: Flags [.], ack 66200, win 512, length 0
16:31:07.661318 IP 198.96.85.21.57248 > lamp-s-1vcpu-1gb-tor1-01.ssh: Flags [.], ack 66692, win 510, length 0
16:31:07.661389 IP 198.96.85.21.57248 > lamp-s-1vcpu-1gb-tor1-01.ssh: Flags [P.], seq 37:73, ack 66692, win 510, length 36
16:31:07.661402 IP 198.96.85.21.57248 > lamp-s-1vcpu-1gb-tor1-01.ssh: Flags [.], ack 68824, win 512, length 0
16:31:07.661421 IP 198.96.85.21.57248 > lamp-s-1vcpu-1gb-tor1-01.ssh: Flags [.], ack 68988, win 512, length 0
^C
