################################
Command:tcpdump tcp -nn
-nn display ip and ports:
################################
15:43:02.713554 IP 165.227.42.212.22 > 198.96.85.21.52403: Flags [P.], seq 846960:847116, ack 397, win 313, length 156
15:43:02.713636 IP 165.227.42.212.22 > 198.96.85.21.52403: Flags [P.], seq 847116:847272, ack 397, win 313, length 156
15:43:02.713733 IP 165.227.42.212.22 > 198.96.85.21.52403: Flags [P.], seq 847272:847428, ack 397, win 313, length 156
15:43:02.713829 IP 165.227.42.212.22 > 198.96.85.21.52403: Flags [P.], seq 847428:847584, ack 397, win 313, length 156
15:43:02.713924 IP 165.227.42.212.22 > 198.96.85.21.52403: Flags [P.], seq 847584:847740, ack 397, win 313, length 156
15:43:02.714037 IP 165.227.42.212.22 > 198.96.85.21.52403: Flags [P.], seq 847740:847896, ack 397, win 313, length 156
15:43:02.714137 IP 165.227.42.212.22 > 198.96.85.21.52403: Flags [P.], seq 847896:848052, ack 397, win 313, length 156
15:43:02.714221 IP 198.96.85.21.52403 > 165.227.42.212.22: Flags [P.], seq 397:433, ack 829988, win 510, length 36
15:43:02.714245 IP 198.96.85.21.52403 > 165.227.42.212.22: Flags [P.], seq 433:469, ack 829988, win 510, length 36
15:43:02.714351 IP 165.227.42.212.22 > 198.96.85.21.52403: Flags [.], ack 469, win 313, length 0
15:43:02.714421 IP 165.227.42.212.22 > 198.96.85.21.52403: Flags [P.], seq 848052:848440, ack 469, win 313, length 388
^C
5574 packets captured
5857 packets received by filter
283 packets dropped by kernel
root@lamp-s-1vcpu-1gb-tor1-01:~#

################################
Source Host:165.227.42.212
Source Port:22
Destination Host:198.96.85.21
Destination 52403
################################

